{
  "schema_version": "daily-compiler-post-publication-correction-v1",
  "correction_id": "oct8-owner-selected-v1-cisco-webex-agentic-collaboration",
  "edition_date": "2026-10-08",
  "requested_at": "2026-10-08T02:05:00Z",
  "requested_by": "owner",
  "correction_type": "replace_image",
  "target": {
    "story_id": "cisco-webex-agentic-collaboration",
    "expected_sha256": "1b08e4e4085c69a151d701e561590e18caac1e282bff30b23d23c66671ce1e06"
  },
  "replacement": {
    "image": {
      "story_id": "cisco-webex-agentic-collaboration",
      "path": "shadow-runs/2026-10-08/images/corrections/owner-selected-v1/cisco-webex-agentic-collaboration.png",
      "sha256": "f40573aa30dd243bbe0a2a2ff87a1ecad5650abac75391dcb80ca95f973768d0",
      "git_blob_sha": "55e4c1dce01fc3b62f336e39675b773f44586724",
      "accepted": true,
      "accepted_locked": true,
      "visual_review": {
        "result": "PASS",
        "reviewed_sha256": "f40573aa30dd243bbe0a2a2ff87a1ecad5650abac75391dcb80ca95f973768d0",
        "exact_persisted_asset": true,
        "quality_gate_location": "owner_selected_chat",
        "owner_selected": true
      },
      "asset_version": "owner-selected-v1",
      "cache_key": "owner-selected-v1-f40573aa30dd",
      "supersedes": {
        "path": "shadow-runs/2026-10-08/images/rendered/cisco-webex-agentic-collaboration/proof.png",
        "sha256": "1b08e4e4085c69a151d701e561590e18caac1e282bff30b23d23c66671ce1e06",
        "git_blob_sha": "92f48efd80714d999a241abcea9986f6f89d7152"
      },
      "bytes": 846785
    }
  },
  "reason": "Owner rejected the published deterministic image as too basic and explicitly selected this exact premium replacement.",
  "status": "VALIDATED",
  "preserve_original": true,
  "new_execution_allowed": false,
  "protected_pr_required": true,
  "live_verification_required": true,
  "semantic_scope": "image_only",
  "correction_revision": 1,
  "supersedes": {
    "path": "shadow-runs/2026-10-08/images/rendered/cisco-webex-agentic-collaboration/proof.png",
    "sha256": "1b08e4e4085c69a151d701e561590e18caac1e282bff30b23d23c66671ce1e06",
    "git_blob_sha": "92f48efd80714d999a241abcea9986f6f89d7152"
  },
  "verification_receipt_path": null
}
